{
  "v": 1, "rev": 1,
  "fixtures": [
    { "id": "tv-left", "label": "TV Left", "type": "virtual", "status": "active", "class": "slow", "x": 0.3, "y": 0.1 },
    { "id": "tv-right", "label": "TV Right", "type": "virtual", "status": "active", "class": "slow", "x": 0.7, "y": 0.1 },
    { "id": "couch-left", "label": "Couch Left", "type": "virtual", "status": "active", "class": "slow", "x": 0.3, "y": 0.8 },
    { "id": "couch-right", "label": "Couch Right", "type": "virtual", "status": "active", "class": "slow", "x": 0.7, "y": 0.8 },
    { "id": "window-lamp", "label": "Window Lamp", "type": "virtual", "status": "active", "class": "slow", "x": 0.05, "y": 0.5 },
    { "id": "pendant", "label": "Pendant", "type": "virtual", "status": "active", "class": "slow", "x": 0.5, "y": 0.5 },
    { "id": "desk", "label": "Desk", "type": "virtual", "status": "not_added", "class": "slow", "x": 0.9, "y": 0.9 }
  ],
  "groups": [],
  "banks": { "A": [null, null, null, null, null, null, null, null],
             "B": [null, null, null, null, null, null, null, null],
             "C": [null, null, null, null, null, null, null, null] }
}
